{"$schema":"./challenger-replacement-supersession-machine-evidence-v1.schema.json","collector_actions":{"broker_request_count":0,"market_request_count":0,"order_count":0,"runner_invocation_count":0,"state_write_count":0},"current_observations":{"canonical_event_count":0,"runtime_root_lstat":"ENOENT","service_state":"NOT_LOADED","start_receipt_count":0,"start_receipt_root_state":"ABSENT_DERIVED_FROM_RUNTIME_ROOT_ABSENT","state_event_count":0,"state_event_root_state":"ABSENT_DERIVED_FROM_RUNTIME_ROOT_ABSENT","target_plist_lstat":"ENOENT"},"effective_uid":501,"evidence_hash":"7d1be628c1e75172dbb536351be1c8e7940d74bd0a828e6390fdae33b8a5f264","evidence_id":"challenger_replacement_supersession_machine_evidence_79ba192b18f7427d0ed78ff04a56c2b0812f66f87ef28fb65dd15ca7bdfd8ca7","evidence_qualification":"REAL_MACHINE_READ_ONLY_SUPERSESSION_PRECONDITION","git_history":{"candidate_head":"3a6cf9cbeaec73038116dddc2bbb264096125db7","candidate_status_porcelain_base64":"","candidate_status_porcelain_sha256":"e3b0c44298fc1c149afbf4c8996fb92427ae41e4649b934ca495991b7852b855","git_history_evidence_hash":"bc0612f2100b97cc209004883487303320fa34f2f8db69ecc80ae979e6ff167e","transcripts":[{"argv":["/usr/bin/git","-C","/Users/chenm4/Documents/虚拟货币/.worktrees/v0.64-public-ci-r3-design","rev-parse","v0.62.0"],"exit_code":0,"name":"v0_62_tag_object","stderr_base64":"","stderr_sha256":"e3b0c44298fc1c149afbf4c8996fb92427ae41e4649b934ca495991b7852b855","stdout_base64":"YjMzYzBjZjU4YTk1NGY1NDhmNzY3OTJmMGI3Y2Y5ODlkY2YwOTAwYwo=","stdout_sha256":"098025e31e030514f5d9ac4e9da454d942647e977d6789cdbe561e746f17fd1e"},{"argv":["/usr/bin/git","-C","/Users/chenm4/Documents/虚拟货币/.worktrees/v0.64-public-ci-r3-design","cat-file","-t","v0.62.0"],"exit_code":0,"name":"v0_62_tag_type","stderr_base64":"","stderr_sha256":"e3b0c44298fc1c149afbf4c8996fb92427ae41e4649b934ca495991b7852b855","stdout_base64":"dGFnCg==","stdout_sha256":"ccda8f9a2cb0295182b9a99e4c8270badcc89525850e1e737a294fb426363ac9"},{"argv":["/usr/bin/git","-C","/Users/chenm4/Documents/虚拟货币/.worktrees/v0.64-public-ci-r3-design","rev-parse","v0.62.0^{}"],"exit_code":0,"name":"v0_62_peeled_commit","stderr_base64":"","stderr_sha256":"e3b0c44298fc1c149afbf4c8996fb92427ae41e4649b934ca495991b7852b855","stdout_base64":"ZTBhOWIzZWI2YTNmMzg1ZWEyNTk3MjJlNjYxM2RmODcwOGU4ZmU1YQo=","stdout_sha256":"87769739c7c28dc37689716caf31ee19e18a2d69d7644a27ac7c86387ce6530c"},{"argv":["/usr/bin/git","-C","/Users/chenm4/Documents/虚拟货币/.worktrees/v0.64-public-ci-r3-design","rev-parse","v0.63.0"],"exit_code":0,"name":"v0_63_tag_object","stderr_base64":"","stderr_sha256":"e3b0c44298fc1c149afbf4c8996fb92427ae41e4649b934ca495991b7852b855","stdout_base64":"YTE0MjkyN2Q5NmM0ZTZkNTJkZjIyZjc5ZTkyOWU2NzlhMjE5ZTgyZQo=","stdout_sha256":"dba2143ab40647591f917beebfb88a15ca9cbc56a2498e18d4573372faf69dcc"},{"argv":["/usr/bin/git","-C","/Users/chenm4/Documents/虚拟货币/.worktrees/v0.64-public-ci-r3-design","cat-file","-t","v0.63.0"],"exit_code":0,"name":"v0_63_tag_type","stderr_base64":"","stderr_sha256":"e3b0c44298fc1c149afbf4c8996fb92427ae41e4649b934ca495991b7852b855","stdout_base64":"dGFnCg==","stdout_sha256":"ccda8f9a2cb0295182b9a99e4c8270badcc89525850e1e737a294fb426363ac9"},{"argv":["/usr/bin/git","-C","/Users/chenm4/Documents/虚拟货币/.worktrees/v0.64-public-ci-r3-design","rev-parse","v0.63.0^{}"],"exit_code":0,"name":"v0_63_peeled_commit","stderr_base64":"","stderr_sha256":"e3b0c44298fc1c149afbf4c8996fb92427ae41e4649b934ca495991b7852b855","stdout_base64":"ZGY5MWUxOTI0MGRmMTQ4MzkxMjU2MDg0MjI0ODlhZGYzYjkwMmU3Ngo=","stdout_sha256":"7a8124906bd053f3959f42d01d7e746af6ec72dd8aa4901db143135c3e0e23b5"},{"argv":["/usr/bin/git","-C","/Users/chenm4/Documents/虚拟货币/.worktrees/v0.64-public-ci-r3-design","rev-parse","HEAD"],"exit_code":0,"name":"candidate_head","stderr_base64":"","stderr_sha256":"e3b0c44298fc1c149afbf4c8996fb92427ae41e4649b934ca495991b7852b855","stdout_base64":"M2E2Y2Y5Y2JlYWVjNzMwMzgxMTZkZGRjMmJiYjI2NDA5NjEyNWRiNwo=","stdout_sha256":"f1d9cbc1e3c5d29372db61a2fbfaab707aa1cfe9531fe1bb547536a9c2bfbb87"},{"argv":["/usr/bin/git","-C","/Users/chenm4/Documents/虚拟货币/.worktrees/v0.64-public-ci-r3-design","merge-base","--is-ancestor","v0.63.0","HEAD"],"exit_code":0,"name":"v0_63_ancestor_of_candidate","stderr_base64":"","stderr_sha256":"e3b0c44298fc1c149afbf4c8996fb92427ae41e4649b934ca495991b7852b855","stdout_base64":"","stdout_sha256":"e3b0c44298fc1c149afbf4c8996fb92427ae41e4649b934ca495991b7852b855"},{"argv":["/usr/bin/git","-C","/Users/chenm4/Documents/虚拟货币/.worktrees/v0.64-public-ci-r3-design","status","--porcelain=v1","--untracked-files=all"],"exit_code":0,"name":"candidate_status","stderr_base64":"","stderr_sha256":"e3b0c44298fc1c149afbf4c8996fb92427ae41e4649b934ca495991b7852b855","stdout_base64":"","stdout_sha256":"e3b0c44298fc1c149afbf4c8996fb92427ae41e4649b934ca495991b7852b855"},{"argv":["/usr/bin/git","-C","/Users/chenm4/Documents/虚拟货币/.worktrees/v0.64-public-ci-r3-design","status","--porcelain=v1","--untracked-files=all","--ignored=matching","--","artifacts/challenger-replacement/"],"exit_code":0,"name":"artifact_namespace_status","stderr_base64":"","stderr_sha256":"e3b0c44298fc1c149afbf4c8996fb92427ae41e4649b934ca495991b7852b855","stdout_base64":"","stdout_sha256":"e3b0c44298fc1c149afbf4c8996fb92427ae41e4649b934ca495991b7852b855"},{"argv":["/usr/bin/git","-C","/Users/chenm4/Documents/虚拟货币/.worktrees/v0.64-public-ci-r3-design","show","v0.62.0:artifacts/challenger-replacement/challenger-replacement-plan-v0.62.0.json"],"exit_code":0,"name":"v0_62_plan_bytes","stderr_base64":"","stderr_sha256":"e3b0c44298fc1c149afbf4c8996fb92427ae41e4649b934ca495991b7852b855","stdout_base64":"eyIkc2NoZW1hIjoiLi9jaGFsbGVuZ2VyLXJlcGxhY2VtZW50LXBsYW4tdjEuc2NoZW1hLmpzb24iLCJhdXRob3JpdHkiOnsiYWNjb3VudF9yZXF1ZXN0c19hbGxvd2VkIjpmYWxzZSwiYnJva2VyX3JlcXVlc3RzX2FsbG93ZWQiOmZhbHNlLCJjcmVkZW50aWFsc19hbGxvd2VkIjpmYWxzZSwibWFya2V0X3JlcXVlc3RfY291bnQiOjAsInByb2R1Y3Rpb25fYWN0aXZhdGlvbiI6ZmFsc2UsInJlYWxfb3JkZXJzX2FsbG93ZWQiOmZhbHNlLCJyZXBsYWNlbWVudF9zdGFydF9hdXRob3JpemVkIjpmYWxzZSwicnVubmVyX2ludm9jYXRpb25fY291bnQiOjAsInJ1bnRpbWVfaW5zdGFsbF9hdXRob3JpemVkIjpmYWxzZSwic3RhdGVfd3JpdGVfY291bnQiOjB9LCJjb2hvcnRfcG9saWN5Ijp7ImFjdGl2ZV9lcGlzb2RlX2FmdGVyX3dpbmRvdyI6IkZPTExPV19UT19OQVRVUkFMX0VYSVQiLCJhbGxfc2xvdHNfcmVxdWlyZWQiOnRydWUsImR1cmF0aW9uX2RheXMiOjkwLCJlbmRfZXhjbHVzaXZlIjpudWxsLCJoaXN0b3JpY2FsX2JhY2tmaWxsX2FsbG93ZWQiOmZhbHNlLCJtYW51YWxfc2xvdF9hbGxvd2VkIjpmYWxzZSwibWF4aW11bV9lcGlzb2RlX2hvdXJzIjoyNCwib2JzZXJ2YXRpb25fdGFpbF9lbmQiOm51bGwsIm9wdGlvbmFsX3N0b3BwaW5nX2FsbG93ZWQiOmZhbHNlLCJwb2xpY3lfaGFzaCI6ImQyM2E2MWM1Y2Q3ZTEyNTNlMGJiMmQyYzg4OGNmMzI5NGY1ODU4MDY3NTliMmRmZDRjYjkwMjhhN2Q2Yzg0ZGQiLCJyZXF1aXJlZF9zbG90X2NvdW50Ijo1NDAsInNsb3RfY2FkZW5jZV9zZWNvbmRzIjoxNDQwMCwic3RhcnRfaW5jbHVzaXZlIjpudWxsLCJzdGFydF9zb3VyY2UiOiJGSVJTVF9WRVJJRklFRF9OQVRVUkFMX1NMT1RfRlJPTV9TVEFSVF9SRUNFSVBUIiwid2luZG93X2V4dGVuc2lvbl9hbGxvd2VkIjpmYWxzZSwid2luZG93X3Jlc2V0X2FsbG93ZWQiOmZhbHNlfSwiZGVjaXNpb25fcG9saWN5Ijp7ImJlZm9yZV9taW5pbXVtX2FjdGlvbiI6IkhPTERfTE9OR19NSU5JTVVNIiwiZW50cnlfcnVsZSI6IkFMTF9DT05ESVRJT05TX1JFUVVJUkVEIiwiZXRoX2xvZ19yZXR1cm5fNV9vcGVyYXRvciI6IkdUIiwiZXRoX2xvZ19yZXR1cm5fNV90aHJlc2hvbGQiOiIwIiwiaW50ZXJ2YWwiOiI0aCIsIm1pbmltdW1faG9sZF9ob3VycyI6OCwibW9tZW50dW1fbGFnX2JhcnMiOjUsIm9sZF9maXhlZF9mb3J3YXJkX3N0YXJ0X3JldXNlZCI6ZmFsc2UsInBvbGljeV9oYXNoIjoiZDQ0NGZiZWU4Y2JjN2MxODZlOGZmMzFmY2NhZTRiMzcwMjAwNjE1NzNkNDQ2ZjRkMmIwNDI4YWNkN2Y5NWJjMSIsInBvc3RfbWluaW11bV9zbWFfZXhpdF9ydWxlIjoiTEFURVNUX0NMT1NFX0xURV9QUklPUl9TTUEyMCIsInJlamVjdGVkX2VudHJ5X2VwaXNvZGVfY3JlYXRlZCI6ZmFsc2UsInNhbWVfc2xvdF9zbWFfZXhpdF9wcmVjZWRlc192ZXJ0aWNhbCI6dHJ1ZSwic2FtZV90aHJlc2hvbGRfc2VtYW50aWNzX2FzX3ByZWRlY2Vzc29yIjp0cnVlLCJzbWEyMF9kaXN0YW5jZV9taW5pbXVtIjoiMC4wMDUiLCJzbWEyMF9kaXN0YW5jZV9vcGVyYXRvciI6IkdURSIsInNtYV93aW5kb3ciOjIwLCJ2ZXJzaW9uIjoiQ0hBTExFTkdFUl9SRVBMQUNFTUVOVF9TTUEyMF9NT01FTlRVTV9WMSIsInZlcnRpY2FsX2V4aXRfaG91cnMiOjI0LCJ3YXJtdXBfYmFyX2NvdW50IjoyMX0sImVsaWdpYmlsaXR5Ijp7ImFpX2FkdmFudGFnZSI6IklORUxJR0lCTEUiLCJjYW5hcnkiOiJJTkVMSUdJQkxFIiwiY29ob3J0X2V2YWx1YXRpb24iOiJJTkVMSUdJQkxFXzkwX0RBWV9FVklERU5DRV9OT1RfU1RBUlRFRCIsImRlcGxveW1lbnQiOiJJTkVMSUdJQkxFX05PVF9JTVBMRU1FTlRFRCIsInByb2ZpdGFiaWxpdHkiOiJJTkVMSUdJQkxFIiwicmVwbGFjZW1lbnRfc3RhcnQiOiJJTkVMSUdJQkxFX05PVF9BVVRIT1JJWkVEIiwicnVudGltZSI6IklORUxJR0lCTEVfTk9UX0lNUExFTUVOVEVEIn0sImV2aWRlbmNlX3BvbGljeSI6eyJhbGxfc3RyZWFtX2luY2x1c2lvbl9yZXF1aXJlZCI6dHJ1ZSwiZXZhbHVhdGlvbl9tZXRob2Rfc291cmNlIjoiUFJFREVDRVNTT1JfVjBfNDRfUExBTl9SRVFVSVJFU19SRVBMQUNFTUVOVF9FVkFMVUFUT1IiLCJmaXJzdF9uYXR1cmFsX3Nsb3RfcmVxdWlyZWQiOnRydWUsImludGVyaW1fZWNvbm9taWNzX3dpdGhoZWxkIjp0cnVlLCJvbGRfYXJjaGl2ZXNfbWlncmF0ZWQiOmZhbHNlLCJvbGRfZGVjaXNpb25zX21pZ3JhdGVkIjpmYWxzZSwib2xkX2VsYXBzZWRfZGF5c19taWdyYXRlZCI6ZmFsc2UsIm9sZF9lcGlzb2Rlc19taWdyYXRlZCI6ZmFsc2UsIm9sZF9wbmxfbWlncmF0ZWQiOmZhbHNlLCJvbGRfcmVjZWlwdHNfbWlncmF0ZWQiOmZhbHNlLCJvbGRfcmVzdWx0c19taWdyYXRlZCI6ZmFsc2UsIm9sZF9zbG90X2JhY2tmaWxsX2FsbG93ZWQiOmZhbHNlLCJwb2xpY3lfaGFzaCI6ImU2MWZlOTk5ZDlkYzdlZDUwYzliMzRhZmM5ZTlkOTY1NTVlNGNjOTgwMDhhNjQ0ZTFmYTVhOWEyMmJlNDVlMTEiLCJwcmVkZWNlc3Nvcl9kZWNvbW1pc3Npb25fcHJlc2VydmVkIjp0cnVlLCJwcmVkZWNlc3Nvcl9mYWlsdXJlX3ByZXNlcnZlZCI6dHJ1ZX0sImZvdW5kYXRpb24iOnsiYnVpbGRfaW5wdXRfdHJlZV9oYXNoIjoiYjc4NjI1NTcyNmU2MDZmZDg0MDlhZDY2ODY3NWFlMzVjZWZiYjg4YTRkMjlmODBkMmNiOGI5MjMyMzgxMmQ3NiIsIm1hbmlmZXN0X2ZpbGVfc2hhMjU2IjoiOGUzYjBmNDU1MjM4ZGUxNzBkNTU4MzZhYjBiNzZiMWUyYjQxYTg5NGU1NDBiZjA3YzBlNDIyYTU5ZTZlNTI5NiIsIm1hbmlmZXN0X2hhc2giOiJlMDg0YWMwYWExMjY4MjQyMDRmNmY0MGZiODlkYjUyY2QyNzRlOTZhYmI5NmZkNTEyYWQ2ZmRjY2QyOWVhZGI2IiwibWFuaWZlc3RfdmVyc2lvbiI6IjEuNTUuMCIsInBhY2thZ2VfdmVyc2lvbiI6IjAuNjEuMCIsInBlZWxlZF9jb21taXQiOiIwODExNDAyYWU0ZjliYWViZjkwNWY1NDgzMzZjYTJjMjk4ODVjZTljIiwicmVsZWFzZV90YWciOiJ2MC42MS4wIn0sImlzb2xhdGlvbl9wb2xpY3kiOnsiY3Jvc3Nfcm9vdF9pbm9kZV9yZXVzZV9hbGxvd2VkIjpmYWxzZSwiZGlyZWN0b3J5X21vZGVfb2N0YWwiOiIwNzAwIiwiZmlsZV9tb2RlX29jdGFsIjoiMDYwMCIsImZvcmJpZGRlbl9ydW50aW1lX3Jvb3RzIjpbIi9Vc2Vycy9jaGVubTQvTGlicmFyeS9BcHBsaWNhdGlvbiBTdXBwb3J0L0NyeXB0b1F1YW50L2NoYWxsZW5nZXItZm9yd2FyZC12MSIsIi9Vc2Vycy9jaGVubTQvTGlicmFyeS9BcHBsaWNhdGlvbiBTdXBwb3J0L0NyeXB0b1F1YW50L3N5c3RlbS